Movie_id,Movie_Name,Storyline,Budget,Language,Revenue,Image,Rating,Genre1,Genre2,Genre3,Cast1,Cast2,Cast3
459,Spiral: From the Book of Saw,"Working in the shadow of an esteemed police veteran, brash Detective Ezekiel “Zeke” Banks and his rookie partner take charge of a grisly investigation into murders that are eerily reminiscent of the city’s gruesome past.  Unwittingly entrapped in a deepening mystery, Zeke finds himself at the center of the killer’s morbid game.",20000000,English,40618920,https://image.tmdb.org/t/p/w220_and_h330_face/lcyKve7nXRFgRyms9M1bndNkKOx.jpg,61,Horror,Crime,Mystery,Chris Rock,Samuel L. Jackson,Max Minghella
460,Scooby-Doo,"The Mystery Inc. gang have gone their separate ways and have been apart for two years, until they each receive an invitation to Spooky Island. Not knowing that the others have also been invited, they show up and discover an amusement park that affects young visitors in very strange ways.",84000000,English,275650703,https://image.tmdb.org/t/p/w220_and_h330_face/98zsG0FX7z6R4i5q0HONLM21dpt.jpg,60,Mystery,Adventure,Comedy,Freddie Prinze Jr.,Sarah Michelle Gellar,Matthew Lillard
461,Tangled,"When the kingdom's most wanted-and most charming-bandit Flynn Rider hides out in a mysterious tower, he's taken hostage by Rapunzel, a beautiful and feisty tower-bound teen with 70 feet of magical, golden hair. Flynn's curious captor, who's looking for her ticket out of the tower where she's been locked away for years, strikes a deal with the handsome thief and the unlikely duo sets off on an action-packed escapade, complete with a super-cop horse, an over-protective chameleon and a gruff gang of pub thugs.",260000000,English,592461732,https://image.tmdb.org/t/p/w220_and_h330_face/ym7Kst6a4uodryxqbGOxmewF235.jpg,76,Animation,Family,unknown,Mandy Moore,Zachary Levi,Donna Murphy
463,Yu-Gi-Oh!: The Dark Side of Dimensions,Yugi and Kaiba have a special duel that transcends dimensions.,0,Japanese,1015339,https://image.tmdb.org/t/p/w220_and_h330_face/nFQkn1KE0Is3FUW0yPPgdVvCnlo.jpg,76,Adventure,Animation,unknown,Kenjiro Tsuda,Shunsuke Kazama,Hiroki Takahashi
464,The Parent Trap,"Hallie Parker and Annie James are identical twins separated at a young age because of their parents' divorce. Unknowingly to their parents, the girls are sent to the same summer camp where they meet, discover the truth about themselves, and then plot with each other to switch places.",15000000,English,92108518,https://image.tmdb.org/t/p/w220_and_h330_face/a3XOGrrAjl1wwiumtACWBufg6AL.jpg,71,Comedy,Family,unknown,Lindsay Lohan,Dennis Quaid,Natasha Richardson
465,Cars 2,Star race car Lightning McQueen and his pal Mater head overseas to compete in the World Grand Prix race. But the road to the championship becomes rocky as Mater gets caught up in an intriguing adventure of his own: international espionage.,200000000,English,559852396,https://image.tmdb.org/t/p/w220_and_h330_face/okIz1HyxeVOMzYwwHUjH2pHi74I.jpg,60,Animation,Family,Adventure,Larry the Cable Guy,Owen Wilson,Michael Caine
466,"The Chronicles of Narnia: The Lion, the Witch and the Wardrobe","Siblings Lucy, Edmund, Susan and Peter step through a magical wardrobe and find the land of Narnia. There, they discover a charming, once peaceful kingdom that has been plunged into eternal winter by the evil White Witch, Jadis. Aided by the wise and magnificent lion, Aslan, the children lead Narnia into a spectacular, climactic battle to be free of the Witch's glacial powers forever.",180000000,English,745013115,https://image.tmdb.org/t/p/w220_and_h330_face/kzJip9vndXYSKQHCgekrgqbnUrA.jpg,71,Adventure,Family,Fantasy,Georgie Henley,Skandar Keynes,William Moseley
467,Tom Clancy's Without Remorse,An elite Navy SEAL uncovers an international conspiracy while seeking justice for the murder of his pregnant wife.,0,English,0,https://image.tmdb.org/t/p/w220_and_h330_face/6GCOpT8QcNzup09TAMmvvk22LTR.jpg,71,Action,Thriller,unknown,Michael B. Jordan,Jamie Bell,Guy Pearce
468,Me Before You,"A small town girl is caught between dead-end jobs. A high-profile, successful man becomes wheelchair bound following an accident. The man decides his life is not worth living until the girl is hired for six months to be his new caretaker. Worlds apart and trapped together by circumstance, the two get off to a rocky start. But the girl becomes determined to prove to the man that life is worth living and as they embark on a series of adventures together, each finds their world changing in ways neither of them could begin to imagine.",20000000,English,207945075,https://image.tmdb.org/t/p/w220_and_h330_face/oo2Q3T8juOYFh2G1YJ3oSMAfUyq.jpg,79,Drama,Romance,unknown,Emilia Clarke,Sam Claflin,Janet McTeer
469,The Last Airbender,"The story follows the adventures of Aang, a young successor to a long line of Avatars, who must put his childhood ways aside and stop the Fire Nation from enslaving the Water, Earth and Air nations.",150000000,English,319713881,https://image.tmdb.org/t/p/w220_and_h330_face/zgwRTYWEEPivTwjB9S03HtmMcbM.jpg,47,Action,Adventure,Fantasy,Noah Ringer,Dev Patel,Nicola Peltz
470,Ready Player One,"When the creator of a popular video game system dies, a virtual contest is created to compete for his fortune.",175000000,English,582890172,https://image.tmdb.org/t/p/w220_and_h330_face/pU1ULUq8D3iRxl1fdX2lZIzdHuI.jpg,76,Science Fiction,Adventure,Action,Tye Sheridan,Olivia Cooke,Ben Mendelsohn
471,Jiu Jitsu,"Every six years, an ancient order of jiu-jitsu fighters joins forces to battle a vicious race of alien invaders. But when a celebrated war hero goes down in defeat, the fate of the planet and mankind hangs in the balance.",23000000,English,99924,https://image.tmdb.org/t/p/w220_and_h330_face/eLT8Cu357VOwBVTitkmlDEg32Fs.jpg,50,Action,Science Fiction,Fantasy,Nicolas Cage,Alain Moussi,Frank Grillo
472,The Hangover,"When three friends finally come to after a raucous night of bachelor-party revelry, they find a baby in the closet and a tiger in the bathroom. But they can't seem to locate their best friend, Doug – who's supposed to be tying the knot. Launching a frantic search for Doug, the trio perseveres through a nasty hangover to try to make it to the church on time.",35000000,English,469310836,https://image.tmdb.org/t/p/w220_and_h330_face/jjCPcxw7QCmFPYM1t3BThdEawJK.jpg,73,Comedy,unknown,unknown,Bradley Cooper,Ed Helms,Zach Galifianakis
473,Shark: The Beginning,"A bullied teenager who is locked up at a juvenile detention center due to an unexpected accident, meets a mixed martial arts champion to break through his own limits.",0,Korean,0,https://image.tmdb.org/t/p/w220_and_h330_face/r3zWv3Ly1Y2NZrGHFaQntCS4MT7.jpg,70,Action,unknown,unknown,Kim Min-seok,Wi Ha-jun,Jung Won-chang
474,Midnight,A serial killer ruthlessly hunts down a deaf woman through the streets of South Korea after she witnesses his brutal crime.,0,Korean,0,https://image.tmdb.org/t/p/w220_and_h330_face/gXaS8OuavUsEjoW7P8qKrHTGPi1.jpg,72,Thriller,unknown,unknown,Jin Ki-joo,Wi Ha-jun,Park Hoon
475,Female Doctor: Flesh Slave,We don't have an overview translated in English. Help us expand our database by adding one.,0,Japanese,0,https://image.tmdb.org/t/p/w220_and_h330_face/rqZn4V6ugU3FmBYPxagv9vjR6zR.jpg,20,Crime,unknown,unknown,Kaori Asô,Yasuko Takahashi,Kansai Eto
476,The Stronghold,"A police brigade working in the dangerous northern neighborhoods of Marseille, where the level of crime is higher than anywhere else in France.",14479740,French,0,https://image.tmdb.org/t/p/w220_and_h330_face/nLanxl7Xhfbd5s8FxPy8jWZw4rv.jpg,75,Thriller,Action,Crime,Gilles Lellouche,François Civil,Karim Leklou
477,John Wick: Chapter 3 - Parabellum,"Super-assassin John Wick returns with a $14 million price tag on his head and an army of bounty-hunting killers on his trail. After killing a member of the shadowy international assassin’s guild, the High Table, John Wick is excommunicado, but the world’s most ruthless hit men and women await his every turn.",55000000,English,326709727,https://image.tmdb.org/t/p/w220_and_h330_face/ziEuG1essDuWuC5lpWUaw1uXY2O.jpg,74,Action,Thriller,Crime,Keanu Reeves,Halle Berry,Laurence Fishburne
478,Rescued by Ruby,"Chasing his dream to join an elite K-9 unit, a state trooper partners with a fellow underdog: clever but naughty shelter pup Ruby. Based on a true story.",0,English,0,https://image.tmdb.org/t/p/w220_and_h330_face/tPlJEodEn0SSV4avo8KSawtlTlN.jpg,72,Family,Drama,unknown,Grant Gustin,Scott Wolf,Kaylah Zander
479,Maleficent: Mistress of Evil,"Maleficent and her goddaughter Aurora begin to question the complex family ties that bind them as they are pulled in different directions by impending nuptials, unexpected allies, and dark new forces at play.",185000000,English,491570967,https://image.tmdb.org/t/p/w220_and_h330_face/vloNTScJ3w7jwNwtNGoG8DbTThv.jpg,73,Family,Fantasy,Adventure,Angelina Jolie,Elle Fanning,Harris Dickinson
480,Jack Reacher: Never Go Back,"When Major Susan Turner is arrested for treason, ex-investigator Jack Reacher undertakes the challenging task to prove her innocence and ends up exposing a shocking conspiracy.",60000000,English,162146076,https://image.tmdb.org/t/p/w220_and_h330_face/wxLUQ1pIms3HAlVGYvEG9zg2kDs.jpg,59,Action,Thriller,unknown,Tom Cruise,Cobie Smulders,Danika Yarosh
481,Dragon Ball Z: Bio-Broly,"Jaga Bada, Mr. Satan's old sparring partner, has invited Satan to his personal island to hold a grudge match. Trunks and Goten decide to come for the adventure and Android #18 is following Satan for the money he owes her. Little do they know that Jaga Bada's scientist have found a way to resurrect Broly, the legendary Super Saiyan.",0,Japanese,19500000,https://image.tmdb.org/t/p/w220_and_h330_face/A0VKJ6eRIubW6wH4eAwcpQfjoRD.jpg,58,Animation,Action,Science Fiction,Masako Nozawa,Takeshi Kusao,Daisuke Gouri
483,El bucle de Latham,We don't have an overview translated in English. Help us expand our database by adding one.,0,Spanish,0,https://image.tmdb.org/t/p/w220_and_h330_face/vfpplWAbl50qHU1sO2C6Kd1lv6M.jpg,47,Drama,Mystery,unknown,Carlos Bernardino,José Chaves,Antonio Dechent
484,Toy Story 3,"Woody, Buzz, and the rest of Andy's toys haven't been played with in years. With Andy about to go to college, the gang find themselves accidentally left at a nefarious day care center. The toys must band together to escape and return home to Andy.",200000000,English,1066969703,https://image.tmdb.org/t/p/w220_and_h330_face/AbbXspMOwdvwWZgVN0nabZq03Ec.jpg,78,Animation,Family,Comedy,Tom Hanks,Tim Allen,Joan Cusack
485,John Wick: Chapter 2,"John Wick is forced out of retirement by a former associate looking to seize control of a shadowy international assassins’ guild. Bound by a blood oath to aid him, Wick travels to Rome and does battle against some of the world’s most dangerous killers.",40000000,English,171539887,https://image.tmdb.org/t/p/w220_and_h330_face/kL99FVq572hNPfMyfQCT7tGFNeQ.jpg,73,Thriller,Action,Crime,Keanu Reeves,Common,Laurence Fishburne
486,Peter Rabbit 2: The Runaway,"Bea, Thomas, and the rabbits have created a makeshift family, but despite his best efforts, Peter can’t seem to shake his mischievous reputation. Adventuring out of the garden, Peter finds himself in a world where his mischief is appreciated, but when his family risks everything to come looking for him, Peter must figure out what kind of bunny he wants to be.",45000000,English,153000000,https://image.tmdb.org/t/p/w220_and_h330_face/cycDz68DtTjJrDJ1fV8EBq2Xdpb.jpg,73,Family,Comedy,Adventure,James Corden,Rose Byrne,Domhnall Gleeson
487,Home Team,"Two years after a Super Bowl win when NFL head coach Sean Payton is suspended, he goes back to his hometown and finds himself reconnecting with his 12-year-old son by coaching his Pop Warner football team.",0,English,0,https://image.tmdb.org/t/p/w220_and_h330_face/xdPdVJGIQjuVhK7SeK5fpjuc1bu.jpg,68,Family,Comedy,unknown,Kevin James,Taylor Lautner,Rob Schneider
488,SAS: Red Notice,"An off-duty SAS soldier, Tom Buckingham, must thwart a terror attack on a train running through the Channel Tunnel. As the action escalates on the train, events transpire in the corridors of power that may make the difference as to whether Buckingham and the civilian passengers make it out of the tunnel alive.",0,English,0,https://image.tmdb.org/t/p/w220_and_h330_face/6Y9fl8tD1xtyUrOHV2MkCYTpzgi.jpg,59,Drama,Action,Thriller,Sam Heughan,Ruby Rose,Andy Serkis
489,Halo: Nightfall,"Set between the events of Halo 4 and Halo 5: Guardians… Halo: Nightfall tells the dramatic story of legendary man hunter and Naval Intelligence Officer Jameson Locke and his team as they are caught in a horrific biological attack while investigating terrorist activity on the distant colony world of Sedra. As they unravel a plot that draws them to an ancient, hellish artifact, they will be forced to fight for their survival, question everything and ultimately choose between their loyalty and their lives.",0,English,0,https://image.tmdb.org/t/p/w220_and_h330_face/dDtxMHBdspAvc0LbSVEougFuBkW.jpg,70,Science Fiction,unknown,unknown,Mike Colter,Alexis Rodney,Alexander Bhat
491,Awake,"After a sudden global event wipes out all electronics and takes away humankind’s ability to sleep, chaos quickly begins to consume the world. Only Jill, an ex-soldier with a troubled past, may hold the key to a cure in the form of her own daughter. The question is, can Jill safely deliver her daughter and save the world before she herself loses her mind.",0,English,0,https://image.tmdb.org/t/p/w220_and_h330_face/uZkNbB8isWXHMDNoIbqXvmslBMC.jpg,60,Drama,Science Fiction,Thriller,Gina Rodriguez,Ariana Greenblatt,Lucius Hoyos
492,San Andreas,"In the aftermath of a massive earthquake in California, a rescue-chopper pilot makes a dangerous journey across the state in order to rescue his estranged daughter.",110000000,English,473990832,https://image.tmdb.org/t/p/w220_and_h330_face/2Gfjn962aaFSD6eST6QU3oLDZTo.jpg,62,Action,Drama,Thriller,Dwayne Johnson,Alexandra Daddario,Carla Gugino
493,Rascal Does Not Dream of a Dreaming Girl,"In Fujisawa, Sakuta Azusagawa is in his second year of high school. Blissful days with his girlfriend and upperclassman, Mai Sakurajima, are interrupted by the appearance of his first crush, Shoko Makinohara.",0,Japanese,0,https://image.tmdb.org/t/p/w220_and_h330_face/7Ai8vNEv4zEveh12JViGikoVPVV.jpg,84,Animation,Comedy,Romance,Kaito Ishikawa,Asami Seto,Inori Minase
494,Altered Carbon: Resleeved,"On the planet Latimer, Takeshi Kovacs must protect a tattooist while investigating the death of a yakuza boss alongside a no-nonsense CTAC.",0,Japanese,0,https://image.tmdb.org/t/p/w220_and_h330_face/vlIYzx7cc4Wvaoh7ShjF2HZG45.jpg,65,Animation,Science Fiction,unknown,Tatsuhisa Suzuki,Rina Sato,Ayaka Asai
495,The Island of Giant Insects,"After an airplane crash during a school trip, Oribe Mutsumi and her classmates were stranded on a seemingly deserted island. Mutsumi found the other survivors, and used her wilderness knowledge to help them. She expects that they will be rescued in about three days, which doesn't seem so long to endure. However, she didn't account for the fact that the island is populated with gigantic killer insects. Her knowledge of butterflies, wasps, and more may be the only thing that will help any of her classmates survive to be rescued!",0,Japanese,0,https://image.tmdb.org/t/p/w220_and_h330_face/uJFki1BLHvEi4gaPCJvy9SZQZpx.jpg,45,Mystery,Drama,Horror,Momo Asakura,Takuya Eguchi,Misato Fukuen
496,Three Steps Above Heaven,"Story of two young people who belong to different worlds. It is the chronicle of a love improbable, almost impossible but inevitable dragging in a frantic journey they discover the first great love. Babi is a girl from upper-middle class that is educated in goodness and innocence . Hache is a rebellious boy, impulsive, unconscious, has a appetite for risk and danger embodied in endless fights and illegal motorbike races, the limit of common sense",0,Spanish,0,https://image.tmdb.org/t/p/w220_and_h330_face/fcFz2xEZodKOxHDn9DazxPYHDSc.jpg,78,Romance,Drama,unknown,María Valverde,Mario Casas,Álvaro Cervantes
497,Sing,A koala named Buster recruits his best friend to help him drum up business for his theater by hosting a singing competition.,75000000,English,634151679,https://image.tmdb.org/t/p/w220_and_h330_face/zZTlF2eVVUkbdmccd3bNUU9T9sD.jpg,71,Animation,Comedy,Family,Matthew McConaughey,Reese Witherspoon,Seth MacFarlane
498,A Nun's Curse,A group of travelers are forced to seek shelter inside an abandoned jail where a notorious nun named Sister Monday had once been assigned and was suspected of murdering prisoners.,0,English,0,https://image.tmdb.org/t/p/w220_and_h330_face/eutNRwSguV0NCx7BNAXOibWzjP6.jpg,63,Horror,unknown,unknown,Felissa Rose,Damian Maffei,Erika Edwards
499,Cuidado con lo que deseas,We don't have an overview translated in English. Help us expand our database by adding one.,0,Spanish,0,https://image.tmdb.org/t/p/w220_and_h330_face/4QmmlPcHctr3qXcC1AHCwhyWz5p.jpg,48,Family,Fantasy,Comedy,Dani Rovira,José Sacristán,Cecilia Suárez
500,Exploits of a Young Don Juan,"Roger is a 16-year-old who seeks to lose his virginity in this erotic drama. His initial efforts are unsuccessful, but World War I breaks out and men are seen marching off to battle. Roger goes overboard when he is presented with several amorous opportunities.",0,French,0,https://image.tmdb.org/t/p/w220_and_h330_face/lqSQN2vg516g4Jv8k010bNxZyLR.jpg,54,Comedy,Drama,unknown,Fabrice Josso,Serena Grandi,Claudine Auger
501,Apocalypto,"Set in the Mayan civilization, when a man's idyllic presence is brutally disrupted by a violent invading force, he is taken on a perilous journey to a world ruled by fear and oppression where a harrowing end awaits him. Through a twist of fate and spurred by the power of his love for his woman and his family he will make a desperate break to return home and to ultimately save his way of life.",40000000,English,120654337,https://image.tmdb.org/t/p/w220_and_h330_face/cBFQsU1LDBEOl0Ik0cygeB6wCLE.jpg,75,Action,Drama,Thriller,Rudy Youngblood,Raoul Max Trujillo,Gerardo Taracena
502,Jolt,A bouncer with an anger management problem goes on a furious and resentful rampage after the murder of a friend.,0,English,238524,https://image.tmdb.org/t/p/w220_and_h330_face/gYZAHan5CHPFXORpQMvOjCTug4E.jpg,67,Action,Thriller,unknown,Kate Beckinsale,Stanley Tucci,Bobby Cannavale
503,Grown Ups,"After their high school basketball coach passes away, five good friends and former teammates reunite for a Fourth of July holiday weekend.",80000000,English,271430189,https://image.tmdb.org/t/p/w220_and_h330_face/cQGM5k1NtU85n4TUlrOrwijSCcm.jpg,63,Comedy,unknown,unknown,Adam Sandler,Kevin James,Chris Rock
504,Nightbooks,"Alex, a boy obsessed with scary stories, is trapped by a witch in her modern, magical New York City apartment. His original hair-raising tales are the only thing keeping him safe as he desperately tries to find a way out of this twisted place.",0,English,0,https://image.tmdb.org/t/p/w220_and_h330_face/ysJte1iqN8pFQ470tumnViB1wHP.jpg,64,Fantasy,Family,unknown,Winslow Fegley,Lidya Jewett,Krysten Ritter
505,Predators,A group of cold-blooded killers find themselves trapped on an alien planet to be hunted by extraterrestrial Predators.,40000000,English,127233108,https://image.tmdb.org/t/p/w220_and_h330_face/gsnUhWMYLSD8VZS7nrMT9mj9BYr.jpg,62,Science Fiction,Action,Thriller,Adrien Brody,Topher Grace,Alice Braga
506,Captain America: The First Avenger,"During World War II, Steve Rogers is a sickly man from Brooklyn who's transformed into super-soldier Captain America to aid in the war effort. Rogers must stop the Red Skull – Adolf Hitler's ruthless head of weaponry, and the leader of an organization that intends to use a mysterious device of untold powers for world domination.",140000000,English,370569774,https://image.tmdb.org/t/p/w220_and_h330_face/vSNxAJTlD0r02V9sPYpOjqDZXUK.jpg,70,Action,Adventure,Science Fiction,Chris Evans,Tommy Lee Jones,Hugo Weaving
507,Kingsman: The Secret Service,The story of a super-secret spy organization that recruits an unrefined but promising street kid into the agency's ultra-competitive training program just as a global threat emerges from a twisted tech genius.,81000000,English,414351546,https://image.tmdb.org/t/p/w220_and_h330_face/ay7xwXn1G9fzX9TUBlkGA584rGi.jpg,76,Crime,Comedy,Action,Taron Egerton,Colin Firth,Mark Strong
508,Dragon Ball Z: The World's Strongest,"The evil Dr. Kochin uses the dragon balls to resurrect his mentor, Dr. Wheelo, in an effort to take over the world. Dr. Wheelo, his body having been destroyed by the avalanche that killed him fifty years before, desires the body of the strongest fighter in the world as his new vessel. Believing Roshi to be the world's strongest warrior, Dr. Kochin abducts Bulma and forces Roshi to surrender himself to save her. When Goku hears of their abduction, he goes to their rescue.",0,Japanese,18000000,https://image.tmdb.org/t/p/w220_and_h330_face/5elbm3iLgGQ6nA5vqUmi9vIojbF.jpg,64,Action,Animation,Science Fiction,Masako Nozawa,Toshio Furukawa,Mayumi Tanaka
509,Public Enemies,"Depression-era bank robber John Dillinger's charm and audacity endear him to much of America's downtrodden public, but he's also a thorn in the side of J. Edgar Hoover and the fledgling FBI. Desperate to capture the elusive outlaw, Hoover makes Dillinger his first Public Enemy Number One and assigns his top agent, Melvin Purvis, the task of bringing him in dead or alive.",100000000,English,214104620,https://image.tmdb.org/t/p/w220_and_h330_face/3KgtekisQBrHRsm2cD5UOB6Ce3k.jpg,67,Action,Crime,unknown,Johnny Depp,Christian Bale,Marion Cotillard
510,Fifty Shades Freed,"Believing they have left behind shadowy figures from their past, newlyweds Christian and Ana fully embrace an inextricable connection and shared life of luxury. But just as she steps into her role as Mrs. Grey and he relaxes into an unfamiliar stability, new threats could jeopardize their happy ending before it even begins.",55000000,English,368307760,https://image.tmdb.org/t/p/w220_and_h330_face/9ZedQHPQVveaIYmDSTazhT3y273.jpg,67,Drama,Romance,unknown,Dakota Johnson,Jamie Dornan,Eric Johnson
511,Host,"Six friends hire a medium to hold a séance via Zoom during lockdown — but they get far more than they bargained for as things quickly go wrong. When an evil spirit starts invading their homes, they begin to realize they might not survive the night.",0,English,26745,https://image.tmdb.org/t/p/w220_and_h330_face/h7dZpJDORYs5c56dydbrLFkEXpE.jpg,66,Horror,Thriller,Mystery,Haley Bishop,Jemma Moore,Emma Louise Webb
512,The Twilight Saga: Breaking Dawn - Part 2,"After the birth of Renesmee, the Cullens gather other vampire clans in order to protect the child from a false allegation that puts the family in front of the Volturi.",120000000,English,829000000,https://image.tmdb.org/t/p/w220_and_h330_face/jHE7WUf3FDod8vw3O3twh0JVZun.jpg,65,Adventure,Fantasy,Drama,Kristen Stewart,Robert Pattinson,Taylor Lautner
513,The Unforgivable,A woman is released from prison after serving a sentence for a violent crime and re-enters a society that refuses to forgive her past.,0,English,0,https://image.tmdb.org/t/p/w220_and_h330_face/1b3dNFDuE7i05TJlXrIC571yR01.jpg,75,Drama,Crime,unknown,Sandra Bullock,Viola Davis,Vincent D'Onofrio
514,The Shack,"After suffering a family tragedy, Mack Phillips spirals into a deep depression causing him to question his innermost beliefs. Facing a crisis of faith, he receives a mysterious letter urging him to an abandoned shack deep in the Oregon wilderness. Despite his doubts, Mack journeys to the shack and encounters an enigmatic trio of strangers led by a woman named Papa. Through this meeting, Mack finds important truths that will transform his understanding of his tragedy and change his life forever.",20000000,English,92924405,https://image.tmdb.org/t/p/w220_and_h330_face/doAzav9kfdtsoSdw1MDFvjKq3J4.jpg,74,Drama,Fantasy,unknown,Sam Worthington,Octavia Spencer,Tim McGraw
515,Seobok: Project Clone,"A former intelligence agent gets involved with the first human clone, Seobok, who others seek, causing trouble.",0,Korean,0,https://image.tmdb.org/t/p/w220_and_h330_face/nxxuWC32Y6TULj4VnVwMPUFLIpK.jpg,75,Science Fiction,Action,unknown,Gong Yoo,Park Bo-gum,Jo Woo-jin
516,Escape from Mogadishu,Diplomats from the North and South Korean embassies in Somalia attempt a daring joint escape from Mogadishu when the outbreak of civil war leaves them stranded.,0,Korean,29855981,https://image.tmdb.org/t/p/w220_and_h330_face/grFDK4ddh2IMn464Ve4ke4uz2ao.jpg,72,War,Drama,Action,Kim Yoon-seok,Jo In-sung,Heo Joon-ho
517,The Twilight Saga: Breaking Dawn - Part 1,The new found married bliss of Bella Swan and vampire Edward Cullen is cut short when a series of betrayals and misfortunes threatens to destroy their world.,110000000,English,712171856,https://image.tmdb.org/t/p/w220_and_h330_face/dSSzv6JrlwS48pBeTNSswLJXOYF.jpg,62,Adventure,Fantasy,Romance,Kristen Stewart,Robert Pattinson,Taylor Lautner
518,The Nun,"When a young nun at a cloistered abbey in Romania takes her own life, a priest with a haunted past and a novitiate on the threshold of her final vows are sent by the Vatican to investigate. Together they uncover the order’s unholy secret. Risking not only their lives but their faith and their very souls, they confront a malevolent force in the form of the same demonic nun that first terrorized audiences in “The Conjuring 2” as the abbey becomes a horrific battleground between the living and the damned.",22000000,English,365550119,https://image.tmdb.org/t/p/w220_and_h330_face/sFC1ElvoKGdHJIWRpNB3xWJ9lJA.jpg,58,Horror,Mystery,Thriller,Demián Bichir,Taissa Farmiga,Jonas Bloquet
