Movie_id,Movie_Name,Storyline,Budget,Language,Revenue,Image,Rating,Genre1,Genre2,Genre3,Cast1,Cast2,Cast3
750,Jonah Hex,"Gunslinger Jonah Hex is appointed by President Ulysses Grant to track down terrorist Quentin Turnbull, a former Confederate officer determined on unleashing hell on earth. Jonah not only secures freedom by accepting this task, he also gets revenge on the man who slayed his wife and child.",47000000,English,10539000,https://image.tmdb.org/t/p/w220_and_h330_face/1MpWjcCn8M0763QDoxcN0gXrc5q.jpg,49,Action,Western,Drama,Josh Brolin,John Malkovich,Megan Fox
751,Brave,"Brave is set in the mystical Scottish Highlands, where Mérida is the princess of a kingdom ruled by King Fergus and Queen Elinor. An unruly daughter and an accomplished archer, Mérida one day defies a sacred custom of the land and inadvertently brings turmoil to the kingdom. In an attempt to set things right, Mérida seeks out an eccentric old Wise Woman and is granted an ill-fated wish. Also figuring into Mérida’s quest — and serving as comic relief — are the kingdom’s three lords: the enormous Lord MacGuffin, the surly Lord Macintosh, and the disagreeable Lord Dingwall.",185000000,English,538983207,https://image.tmdb.org/t/p/w220_and_h330_face/L6qqU6Q3k4MmPojncNbT43FSTL.jpg,70,Animation,Adventure,Comedy,Kelly Macdonald,Billy Connolly,Emma Thompson
752,Sweet & Sour,"Faced with real-world opportunities and challenges, a couple endures the highs and lows of trying to make a long-distance relationship survive.",0,Korean,0,https://image.tmdb.org/t/p/w220_and_h330_face/3yGwAPl6LWpi8QwHjwCMaqsPgNB.jpg,79,Comedy,Romance,unknown,Jang Ki-yong,Chae Soo-bin,Krystal Jung
753,I Want to Eat Your Pancreas,"After his classmate and crush is diagnosed with a pancreatic disease, an average high schooler sets out to make the most of her final days.",0,Japanese,33748006,https://image.tmdb.org/t/p/w220_and_h330_face/vHdVU0HyyB6k6kuYt8qjwTz9one.jpg,83,Animation,Drama,Romance,Mahiro Takasugi,Lynn,Jun Fukushima
754,Taken,"While vacationing with a friend in Paris, an American girl is kidnapped by a gang of human traffickers intent on selling her into forced prostitution. Working against the clock, her ex-spy father must pull out all the stops to save her. But with his best years possibly behind him, the job may be more than he can handle.",25000000,English,226830568,https://image.tmdb.org/t/p/w220_and_h330_face/wrJjDB8SSJJKcpXVf4KAxZIHvBZ.jpg,74,Action,Thriller,unknown,Liam Neeson,Maggie Grace,Leland Orser
755,Miss Peregrine's Home for Peculiar Children,A teenager finds himself transported to an island where he must help protect a group of orphans with special powers from creatures intent on destroying them.,110000000,English,296482446,https://image.tmdb.org/t/p/w220_and_h330_face/6lSkpu2SDj71KTBy2DllM6CaFYA.jpg,68,Fantasy,Adventure,Family,Eva Green,Asa Butterfield,Samuel L. Jackson
756,Dumbo,"Dumbo is a baby elephant born with over-sized ears and a supreme lack of confidence. But thanks to his even more diminutive buddy Timothy the Mouse,  the pint-sized pachyderm learns to surmount all obstacles.",812000,English,1600000,https://image.tmdb.org/t/p/w220_and_h330_face/4x9FmvdJ464Fg7A9XcbYSmxfVw3.jpg,70,Animation,Family,unknown,Sterling Holloway,Herman Bing,John McLeish
758,Jackie Chan Kung Fu Master,"Jackie Chan is the undefeated Kung Fu Master who dishes out the action in traditional Jackie Chan style. When a young boy sets out to learn how to fight from the Master himself, he not only witnesses some spectacular fights, but learns some important life lessons along the way.",0,Chinese,0,https://image.tmdb.org/t/p/w220_and_h330_face/ds8xP7319zuPMa09kxzkIPBsHVL.jpg,43,Action,Comedy,Family,Zhang Yishan,Tang Yan,Zhang Yibai
759,Minnal Murali,A tailor gains special powers after being struck by lightning but must take down an unexpected foe if he is to become the superhero his hometown in Kerala needs.,2800000,Malayalam,0,https://image.tmdb.org/t/p/w220_and_h330_face/5jHnykugFB3awLTwDM5LQ93TIzs.jpg,72,Action,Adventure,Comedy,Tovino Thomas,Guru Somasundaram,Harisree Ashokan
760,Man of Steel,"A young boy learns that he has extraordinary powers and is not of this earth. As a young man, he journeys to discover where he came from and what he was sent here to do. But the hero in him must emerge if he is to save the world from annihilation and become the symbol of hope for all mankind.",225000000,English,754045518,https://image.tmdb.org/t/p/w220_and_h330_face/7rIPjn5TUK04O25ZkMyHrGNPgLx.jpg,66,Action,Adventure,Fantasy,Henry Cavill,Amy Adams,Michael Shannon
761,Eraser: Reborn,"U.S. Marshal Mason Pollard specializes in “erasing” people – faking the deaths of high-risk witnesses. With the technological advances of the last 25 years, the game has upgraded, and it’s just another day at the office when he’s assigned to Rina Kimura, a crime boss’ wife who’s decided to turn state’s evidence. As the two flee to Cape Town, South Africa, Pollard discovers he’s been set up and will need to be at the top of his game, or he’ll be the one who’s erased.",0,English,0,https://image.tmdb.org/t/p/w220_and_h330_face/lWE48knKsaPGqVoANXoWraiub2d.jpg,70,Action,unknown,unknown,Dominic Sherwood,Jacky Lai,McKinley Belcher III
762,Barbie: A Fashion Fairytale,"Join Barbie in a colourful, modern-day fairytale filled with fashion, friends and fun! Barbie and her dog Sequin jet off to visit her Aunt's amazing fashion house in Paris, and much to her surprise it's about to be shut down forever. After she discovers three enchanting Flairies with sparkle-magic powers, Barbie comes up with a brilliant idea to save the business. She even inspires Alice, a shy fashion designer, and together they create a dazzling runway fashion show. Barbie shows that magic happens when you believe in yourself.",0,English,0,https://image.tmdb.org/t/p/w220_and_h330_face/bFnf8f8DXdCANQ7Y62djgubhh4P.jpg,72,Family,Animation,unknown,Diana Kaarina,Adrian Petriw,Tabitha St. Germain
763,Alice in Wonderland,"Alice, now 19 years old, returns to the whimsical world she first entered as a child and embarks on a journey to discover her true destiny.",200000000,English,1025467110,https://image.tmdb.org/t/p/w220_and_h330_face/o0kre9wRCZz3jjSjaru7QU0UtFz.jpg,66,Family,Fantasy,Adventure,Mia Wasikowska,Johnny Depp,Anne Hathaway
764,Candyman,"Anthony and his partner move into a loft in the now gentrified Cabrini-Green, and after a chance encounter with an old-timer exposes Anthony to the true story behind Candyman, he unknowingly opens a door to a complex past that unravels his own sanity and unleashes a terrifying wave of violence.",25000000,English,77389310,https://image.tmdb.org/t/p/w220_and_h330_face/ygyoaQ8bCp4kDcLc6SdP5GvqmDW.jpg,62,Horror,unknown,unknown,Yahya Abdul-Mateen II,Teyonah Parris,Colman Domingo
765,The Dinosaur Project,Found footage of an expedition into the Congo jungle where a team of explorers stumbles upon a colony of Dinosaurs.,0,English,2412576,https://image.tmdb.org/t/p/w220_and_h330_face/rUAsgohDDBWLb24FyxdjEZQPava.jpg,55,Adventure,Action,Horror,Natasha Loring,Matt Kane,Richard Dillane
766,Salt,"As a CIA officer, Evelyn Salt swore an oath to duty, honor and country. Her loyalty will be tested when a defector accuses her of being a Russian spy. Salt goes on the run, using all her skills and years of experience as a covert operative to elude capture. Salt's efforts to prove her innocence only serve to cast doubt on her motives, as the hunt to uncover the truth behind her identity continues and the question remains: Who is Salt?""""",110000000,English,293329073,https://image.tmdb.org/t/p/w220_and_h330_face/ppXyhOe8UCEOrBRSYqE3SkHwrcR.jpg,64,Action,Mystery,Thriller,Angelina Jolie,Liev Schreiber,Chiwetel Ejiofor
767,The Jungle Book,"The boy Mowgli makes his way to the man-village with Bagheera, the wise panther. Along the way he meets jazzy King Louie, the hypnotic snake Kaa and the lovable, happy-go-lucky bear Baloo, who teaches Mowgli The Bare Necessities"" of life and the true meaning of friendship.""",4000000,English,205843612,https://image.tmdb.org/t/p/w220_and_h330_face/fyKUxjaOP8KINir6MPFprsGtiT0.jpg,73,Family,Animation,Adventure,Bruce Reitherman,Phil Harris,Sebastian Cabot
768,Black Panther,"King T'Challa returns home to the reclusive, technologically advanced African nation of Wakanda to serve as his country's new leader. However, T'Challa soon finds that he is challenged for the throne by factions within his own country as well as without. Using powers reserved to Wakandan kings, T'Challa assumes the Black Panther mantle to join with ex-girlfriend Nakia, the queen-mother, his princess-kid sister, members of the Dora Milaje (the Wakandan 'special forces') and an American secret agent, to prevent Wakanda from being dragged into a world war.",200000000,English,1347597973,https://image.tmdb.org/t/p/w220_and_h330_face/uxzzxijgPIY7slzFvMotPv8wjKA.jpg,74,Action,Adventure,Science Fiction,Chadwick Boseman,Michael B. Jordan,Lupita Nyong'o
769,Final Destination 3,"A student's premonition of a deadly rollercoaster ride saves her life and a lucky few, but not from death itself – which seeks out those who escaped their fate.",25000000,English,118890272,https://image.tmdb.org/t/p/w220_and_h330_face/p7ARuNKUGPGvkBiDtIDvAzYzonX.jpg,61,Horror,Mystery,unknown,Mary Elizabeth Winstead,Ryan Merriman,Kris Lemche
770,Tall Girl 2,"After Jodi Kreyman gains popularity, her miscommunications start causing rifts with those around her and now she really needs to stand tall"".""",24393503,English,0,https://image.tmdb.org/t/p/w220_and_h330_face/eyKkLdst2vFRjCC89C3NqGCLpNE.jpg,58,Comedy,Romance,unknown,Ava Michelle,Griffin Gluck,Sabrina Carpenter
771,Bambi,"Bambi's tale unfolds from season to season as the young prince of the forest learns about life, love, and friends.",858000,English,267447150,https://image.tmdb.org/t/p/w220_and_h330_face/wV9e2y4myJ4KMFsyFfWYcUOawyK.jpg,70,Animation,Drama,Family,Donnie Dunagan,Peter Behn,Stan Alexander
772,Trigger Point,Nicolas Shaw is a retired U.S. special operative who becomes part of an elite 'invisible' team that quietly takes out the worst villains around the world.,0,English,0,https://image.tmdb.org/t/p/w220_and_h330_face/qlXenN6jjgbsIyEJxBjkfkEU0q8.jpg,64,Action,Thriller,unknown,Barry Pepper,Laura Vandervoort,Colm Feore
773,Incredibles 2,"Elastigirl springs into action to save the day, while Mr. Incredible faces his greatest challenge yet – taking care of the problems of his three children.",200000000,English,1242805359,https://image.tmdb.org/t/p/w220_and_h330_face/9lFKBtaVIhP7E2Pk0IY1CwTKTMZ.jpg,75,Action,Adventure,Animation,Craig T. Nelson,Holly Hunter,Sarah Vowell
774,Law Abiding Citizen,A frustrated man decides to take justice into his own hands after a plea bargain sets one of his family's killers free. He targets not only the killer but also the district attorney and others involved in the deal.,53000000,English,126690726,https://image.tmdb.org/t/p/w220_and_h330_face/fcEXcip7v0O1ndV4VUdFqJSqbOg.jpg,73,Drama,Crime,Thriller,Jamie Foxx,Gerard Butler,Colm Meaney
775,Dreamcatcher,"The film centers on two estranged sisters who, along with their friends, become entrenched in a 48 hour whirlwind of violence after a traumatic experience at an underground music festival.",0,English,0,https://image.tmdb.org/t/p/w220_and_h330_face/3CF743g2BpC8r3mCVV9gSX2yQBj.jpg,62,Horror,Mystery,Thriller,Niki Koss,Zachary Gordon,Travis Burns
776,Despicable Me 3,Gru and his wife Lucy must stop former '80s child star Balthazar Bratt from achieving world domination.,80000000,English,1031552585,https://image.tmdb.org/t/p/w220_and_h330_face/6t3YWl7hrr88lCEFlGVqW5yV99R.jpg,64,Action,Animation,Comedy,Steve Carell,Kristen Wiig,Trey Parker
777,Dead Like Me: Life After Death,"When George and her colleagues get a new boss whose focus is on moving souls quickly and enjoying life without consequences, the team begins to break the strict reaper rules. While her friends fall victim to their desires for money, success, and fame, George breaks another rule by revealing her true identity to her living family.",5000000,English,0,https://image.tmdb.org/t/p/w220_and_h330_face/Ar7uTVlawrZRmLad0TrgkhxsTGP.jpg,62,Drama,Fantasy,Comedy,Ellen Muth,Jasmine Guy,Callum Blue
779,The Twilight Saga: New Moon,"Forks, Washington resident Bella Swan is reeling from the departure of her vampire love, Edward Cullen, and finds comfort in her friendship with Jacob Black, a werewolf. But before she knows it, she's thrust into a centuries-old conflict, and her desire to be with Edward at any cost leads her to take greater and greater risks.",50000000,English,709827462,https://image.tmdb.org/t/p/w220_and_h330_face/j5jM5pq78ObAXX1WhTsb115EkLl.jpg,60,Adventure,Fantasy,Drama,Kristen Stewart,Robert Pattinson,Taylor Lautner
780,UFO,"When aspiring musician and student Deniz falls for a rough-hewn motorbike racer, tragedy and family opposition obstruct their path to love.",0,Turkish,0,https://image.tmdb.org/t/p/w220_and_h330_face/m7mNjsZKuLpBWYNGSTLmWKOYkvl.jpg,57,Drama,Romance,unknown,İpek Filiz Yazıcı,Mert Ramazan Demir,Ferit Aktuğ
781,Escape the Undertaker,"The Undertaker has set a trap for the decorated tag team The New Day at his mansion. What they don't know: The Undertaker's mansion is an extreme Haunted House, packed to the brim with supernatural challenges. It's up to viewers to decide the fate of these poor souls trying to survive the wrath of The Undertaker.",0,English,0,https://image.tmdb.org/t/p/w220_and_h330_face/dSF7INctoCQ4iPFRiRkZjIQIIVa.jpg,53,Horror,Mystery,Family,Mark Calaway,Kofi Sarkodie-Mensah,Austin Watson
783,The Banishing,"In the 1930s, a young reverend and his family are forced to confront their worst fears when they discover their new home holds a horrifying secret.",0,English,0,https://image.tmdb.org/t/p/w220_and_h330_face/xD9mc8JCVXA8T8u4Od7qOUBuGH4.jpg,55,Horror,unknown,unknown,Jessica Brown Findlay,John Heffernan,John Lynch
784,Batman Begins,"Driven by tragedy, billionaire Bruce Wayne dedicates his life to uncovering and defeating the corruption that plagues his home, Gotham City.  Unable to work within the system, he instead creates a new identity, a symbol of fear for the criminal underworld - The Batman.",150000000,English,374218673,https://image.tmdb.org/t/p/w220_and_h330_face/8RW2runSEc34IwKN2D1aPcJd2UL.jpg,77,Action,Crime,Drama,Christian Bale,Michael Caine,Liam Neeson
785,Away,"After suffering a plane crash on a mysterious island, a young man embarks on an epic journey through forests, deserts and mountains trying to escape the shadow of a huge dark spirit.",0,English,0,https://image.tmdb.org/t/p/w220_and_h330_face/c59eplVELdwrUfGBUAZVin3HfaL.jpg,64,Animation,Drama,Adventure,unknown,unknown,unknown
786,The Experiment,20 men are chosen to participate in the roles of guards and prisoners in a psychological study that ultimately spirals out of control.,21800000,English,0,https://image.tmdb.org/t/p/w220_and_h330_face/zy6hJYii2PJfMRoUBlULhfuLsgL.jpg,64,Thriller,Drama,unknown,Adrien Brody,Cam Gigandet,Forest Whitaker
787,El mesero,A waiter pretends to be an important businessman in order to reach the upper class through his entrepreneurial dreams.,0,Spanish,0,https://image.tmdb.org/t/p/w220_and_h330_face/zvGC5jX5wQmU1GgPc0VGZz7Mtcs.jpg,80,Comedy,unknown,unknown,Vadhir Derbez,Bárbara López,Arturo Barba
788,Odd Thomas,"In a California desert town, a short-order cook with clairvoyant abilities encounters a mysterious man with a link to dark, threatening forces.",27000000,English,0,https://image.tmdb.org/t/p/w220_and_h330_face/skBMhQjHLTU1rp4gutxHp0JuY1C.jpg,69,Mystery,Thriller,unknown,Anton Yelchin,Addison Timlin,Willem Dafoe
789,Barbie in The 12 Dancing Princesses,"King Randolph sends for his cousin Duchess Rowena to help turn his daughters, Princess Genevieve and her 11 sisters, into better ladies. But the Duchess takes away all the sisters fun, including the sisters favorite pastime: dancing.Thinking all hope is lost they find a secret passageway to a magical land were they can dance the night away.",0,English,0,https://image.tmdb.org/t/p/w220_and_h330_face/opxyzBkB44ubRRyhdrvkoUFWuIj.jpg,77,Animation,Family,unknown,Kelly Sheridan,Catherine O'Hara,Christopher Gaze
791,The King's Avatar: For the Glory,"Prequel movie to the animated series The King's Avatar, dealing with Ye Xiu's original entry into the pro gaming world of Glory, and the first Pro League series tournament.",0,Chinese,0,https://image.tmdb.org/t/p/w220_and_h330_face/aQ7ZUDxcSf8U4ynCstNCMLgdhrD.jpg,69,Animation,Action,Adventure,Zhang Jie,Xinzhu Tong,Kang Liu
792,Aquaman: Heroines of Atlantis,Amber Heard and Nicole Kidman discuss their characters Mera and Atlanna.,0,English,0,https://image.tmdb.org/t/p/w220_and_h330_face/pa7m8nqDrEi7hAGB5vTnCkGLPC2.jpg,75,Documentary,unknown,unknown,Nicole Kidman,Amber Heard,James Wan
793,Madagascar,"Alex the lion is the king of the urban jungle, the main attraction at New York's Central Park Zoo. He and his best friends—Marty the zebra, Melman the giraffe and Gloria the hippo—have spent their whole lives in blissful captivity before an admiring public and with regular meals provided for them. Not content to leave well enough alone, Marty lets his curiosity get the better of him and makes his escape—with the help of some prodigious penguins—to explore the world.",75000000,English,542063846,https://image.tmdb.org/t/p/w220_and_h330_face/94dkWGy17019vslAQpiKwA24uwS.jpg,69,Family,Animation,Adventure,Ben Stiller,Chris Rock,David Schwimmer
794,Spirited Away,"A young girl, Chihiro, becomes trapped in a strange new world of spirits. When her parents undergo a mysterious transformation, she must call upon the courage she never knew she had to free her family.",19000000,Japanese,274925095,https://image.tmdb.org/t/p/w220_and_h330_face/39wmItIWsg5sZMyRUHLkWBcuVCM.jpg,85,Animation,Family,Fantasy,Rumi Hiiragi,Miyu Irino,Mari Natsuki
795,Night in Paradise,"An assassin named Tae-goo is offered a chance to switch sides with his rival Bukseong gang, headed by Chairman Doh. Tae-goo rejects the offer that results in the murder of his sister and niece. In revenge, Tae-goo brutally kills Chairman Doh and his men and flees to Jeju Island where he meets Jae-yeon, a terminally ill woman. Though, the henchman of the Bukseong gang, Executive Ma is mercilessly hunting Tae-goo to take revenge.",0,Korean,0,https://image.tmdb.org/t/p/w220_and_h330_face/dYCWUAidqgakGETwZkfGxU7CWhL.jpg,70,Crime,Drama,Thriller,Um Tae-goo,Jeon Yeo-been,Cha Seung-won
796,Hatching,"12-year-old Tinja is desperate to please her mother, a woman obsessed with presenting the image of a perfect family. One night, Tinja finds a strange egg. What hatches is beyond belief.",3896000,Finnish,490000,https://image.tmdb.org/t/p/w220_and_h330_face/jJbxft0A2iQtH7ZWsGtgCfOq05b.jpg,70,Fantasy,Horror,unknown,Siiri Solalinna,Sophia Heikkilä,Jani Volanen
798,Hypnotic,"A young woman seeking self-improvement enlists the help of a renowned hypnotist but, after a handful of intense sessions, discovers unexpected and deadly consequences.",0,English,0,https://image.tmdb.org/t/p/w220_and_h330_face/miEj4kNc4efZ5WbPJqWl1UXWrvS.jpg,61,Thriller,Drama,Horror,Kate Siegel,Jason O'Mara,Dulé Hill
799,Limitless,"A paranoia-fueled action thriller about an unsuccessful writer whose life is transformed by a top-secret smart drug"" that allows him to use 100% of his brain and become a perfect version of himself. His enhanced abilities soon attract shadowy forces that threaten his new life in this darkly comic and provocative film.""",27000000,English,161849455,https://image.tmdb.org/t/p/w220_and_h330_face/un0a2U7KLjMH77N6EhqYh7ZOlVx.jpg,72,Thriller,Mystery,Science Fiction,Bradley Cooper,Robert De Niro,Abbie Cornish
800,Happy Feet,"Into the world of the Emperor Penguins, who find their soul mates through song, a penguin is born who cannot sing. But he can tap dance something fierce!",100000000,English,384335608,https://image.tmdb.org/t/p/w220_and_h330_face/zP4CK9O70P8GDilfTkPm4lrmaks.jpg,61,Animation,Comedy,Family,Elijah Wood,Robin Williams,Brittany Murphy
801,Stand by Me Doraemon,"In the suburbs of Tokyo some time ago, there lived a clumsy boy about 10 years old. There appeared in front of him named Sewashi, Nobita's descendant of four generations later from the 22nd century, and Doraemon, a 22nd century cat-type caretaker robot who helps people with its secret gadgets. Sewashi claims that his family is suffering from the debts Nobita made even to his generation, so in order to change this disastrous future, he brought along Doraemon as Nobita's caretaker to bring happiness to his future, although Doraemon is not happy about this. And so Sewashi installed an accomplishment program into Doraemon forcing him to take care of Nobita. Unless he makes Nobita happy, Doraemon can no longer go back to the 22nd century. This is how the life of Doraemon and Nobita begins. Will Doraemon succeed this mission and return to the 22nd century?",35000000,Japanese,83061158,https://image.tmdb.org/t/p/w220_and_h330_face/jArnRnllnxbvE2CEV8jc2hhwweS.jpg,73,Animation,Family,Science Fiction,Wasabi Mizuta,Megumi Oohara,Yumi Kakazu
802,Dragon Ball Z: Bardock - The Father of Goku,"Bardock, Son Goku's father, is a low-ranking Saiyan soldier who was given the power to see into the future by the last remaining alien on a planet he just destroyed. He witnesses the destruction of his race and must now do his best to stop Frieza's impending massacre.",0,Japanese,0,https://image.tmdb.org/t/p/w220_and_h330_face/docwOsWZuwJKQdwcYJtQPBcg6bm.jpg,75,Animation,Action,Science Fiction,Masako Nozawa,Kazuyuki Sogabe,Yuko Mita
803,Logan,"In the near future, a weary Logan cares for an ailing Professor X in a hideout on the Mexican border. But Logan's attempts to hide from the world and his legacy are upended when a young mutant arrives, pursued by dark forces.",97000000,English,619021436,https://image.tmdb.org/t/p/w220_and_h330_face/fnbjcRDYn6YviCcePDnGdyAkYsB.jpg,78,Action,Drama,Science Fiction,Hugh Jackman,Dafne Keen,Patrick Stewart
804,Chief Daddy 2: Going for Broke,"The Beecroft family are ready to spend all of Chief Daddy's inheritance, but not if the CEO of his company has anything to do with it.",0,English,0,https://image.tmdb.org/t/p/w220_and_h330_face/mCOhpT4thaUTPbBvFKYibgpNnCy.jpg,57,Comedy,unknown,unknown,Shaffy Bello-Akinrimisi,Funke Akindele,Joke Silva
805,The Good Dinosaur,An epic journey into the world of dinosaurs where an Apatosaurus named Arlo makes an unlikely human friend.,175000000,English,332207671,https://image.tmdb.org/t/p/w220_and_h330_face/j0MuLOCf7q5o62xGVhN80K36xYS.jpg,67,Adventure,Animation,Family,Frances McDormand,Raymond Ochoa,Jeffrey Wright
806,Red Shoes and the Seven Dwarfs,"Princes who have been turned into Dwarfs seek the red shoes of a lady in order to break the spell, although it will not be easy.",0,English,10054356,https://image.tmdb.org/t/p/w220_and_h330_face/MBiKqTsouYqAACLYNDadsjhhC0.jpg,78,Animation,Romance,Family,Chloë Grace Moretz,Sam Claflin,Gina Gershon
807,Heatwave,A woman's life takes an unexpected turn when she falls for her boss's wife. She must soon defend herself as she becomes entangled in a web of malice.,0,English,0,https://image.tmdb.org/t/p/w220_and_h330_face/AeeXeyiiPOyybnjSnJoSTixOZQq.jpg,69,Thriller,unknown,unknown,Kat Graham,Merritt Patterson,Sebastian Roché
808,Ant-Man,"Armed with the astonishing ability to shrink in scale but increase in strength, master thief Scott Lang must embrace his inner-hero and help his mentor, Doctor Hank Pym, protect the secret behind his spectacular Ant-Man suit from a new generation of towering threats. Against seemingly insurmountable obstacles, Pym and Lang must plan and pull off a heist that will save the world.",130000000,English,519311965,https://image.tmdb.org/t/p/w220_and_h330_face/rS97hUJ1otKTTripGwQ0ujbuIri.jpg,71,Science Fiction,Action,Adventure,Paul Rudd,Michael Douglas,Evangeline Lilly
809,A Haunted House,"Malcolm and Kisha move into their dream home, but soon learn a demon also resides there. When Kisha becomes possessed, Malcolm - determined to keep his sex life on track - turns to a priest, a psychic, and a team of ghost-busters for help in this spoof of all the found-footage/documentary style"" films released in recent years.""",2500000,English,60141683,https://image.tmdb.org/t/p/w220_and_h330_face/skQt53YE2iyOftXj5afJkHmYxLW.jpg,58,Comedy,Horror,unknown,Marlon Wayans,Essence Atkins,Nick Swardson
810,Night Teeth,"A college student moonlighting as a chauffeur picks up two mysterious women for a night of party-hopping across LA. But when he uncovers their bloodthirsty intentions—and their dangerous, shadowy underworld—he must fight to stay alive.",21700000,English,0,https://image.tmdb.org/t/p/w220_and_h330_face/4niEFGAUEz3GUqwk9Y2y4aAERhE.jpg,66,Horror,Thriller,Action,Jorge Lendeborg Jr.,Debby Ryan,Lucy Fry
811,Suicide Squad,"From DC Comics comes the Suicide Squad, an antihero team of incarcerated supervillains who act as deniable assets for the United States government, undertaking high-risk black ops missions in exchange for commuted prison sentences.",175000000,English,746846894,https://image.tmdb.org/t/p/w220_and_h330_face/xFw9RXKZDvevAGocgBK0zteto4U.jpg,59,Action,Adventure,Fantasy,Will Smith,Jared Leto,Margot Robbie
812,The Croods,"The prehistoric Croods family live in a particularly dangerous moment in time. Patriarch Grug, his mate Ugga, teenage daughter Eep, son Thunk, and feisty Gran gather food by day and huddle together in a cave at night. When a more evolved caveman named Guy arrives on the scene, Grug is distrustful, but it soon becomes apparent that Guy is correct about the impending destruction of their world.",135000000,English,587204668,https://image.tmdb.org/t/p/w220_and_h330_face/pBn3zbixFgX11lZ84KJgLoELfYd.jpg,69,Animation,Adventure,Family,Nicolas Cage,Ryan Reynolds,Emma Stone
